{
  "schema_version": "classic-knowledge-object-manifest/v0",
  "id": "decision:personal-os-wiki-no-tool-migration-20260623",
  "type": "decision",
  "title": "Personal OS / Wiki 不迁移工具，只吸收可复用模式",
  "summary": "多模型会议决定不迁移到 OpenDeepWiki、Basic Memory、Mem0 或 GraphRAG 全量方案；优先吸收 manifest、context-pack、hybrid retrieval、memory promotion gate、freshness lint、self-improving skill patch flow。",
  "source_path": "docs/sources/personal-os-evolution-council-report-v1-excerpt.md",
  "source_url": null,
  "source_type": "agent-output",
  "hash": {
    "algorithm": "sha256",
    "value": "c01132b80cef749632ae8b4fd9ff50bc064a5fa3bb4b30844596709b27eccc69"
  },
  "freshness": {
    "status": "fresh",
    "captured_at": "2026-06-23T12:03:08+08:00",
    "valid_until": "2026-09-21T00:00:00+08:00",
    "ttl_days": 90,
    "last_checked_at": "2026-06-23T16:40:00+08:00",
    "stale_reason": null
  },
  "sensitivity": {
    "level": "private",
    "contains_secrets": false,
    "allowed_uses": [
      "agent_context",
      "wiki_index",
      "task_execution"
    ],
    "handling_notes": "Internal project decision; cite source before using in public docs."
  },
  "owner": {
    "type": "classic",
    "id": "classic"
  },
  "created_at": "2026-06-23T12:03:08+08:00",
  "updated_at": "2026-06-23T16:40:00+08:00",
  "confidence": "verified",
  "lifecycle": {
    "status": "active",
    "review_policy": "classic_review_required",
    "reviewed_at": null,
    "reviewed_by": null
  },
  "relationships": {
    "project_ids": [
      "cmqq290nm00040jmj9jwa98ya"
    ],
    "task_ids": [
      "cmqq4eqa800340jmjz1go2euo"
    ],
    "source_run_ids": [
      "personal-os-evolution-council-20260623"
    ],
    "supersedes": [],
    "superseded_by": [],
    "related_ids": [
      "task:cmqq4eqa800340jmjz1go2euo",
      "sop:wiki-raw-curated-boundary-20260623"
    ]
  },
  "embedding": {
    "version": "not-indexed-v0",
    "content_hash": null,
    "indexed_at": null
  },
  "content": {
    "format": "markdown",
    "uri": "personal-wiki://30_projects/Personal-OS-Wiki-知识库升级/agent-council-decisions",
    "excerpt": "不迁移工具。吸收模式：manifest、context-pack、hybrid retrieval、memory promotion gate、freshness lint、self-improving skill patch flow。"
  },
  "lint": {
    "waivers": []
  }
}
